{
  "schemaVersion": "1.0.0",
  "settings": {
    "publisher": "Public Domain Pulp",
    "canonicalSiteUrl": "https://publicdomainpulp.net",
    "newsletter": {
      "label": "Subscribe on Substack",
      "url": "https://substack.com/@publicdomainpulppress",
      "kind": "newsletter",
      "verification": "destination-verified",
      "checkedOn": "2026-10-17",
      "sourceIds": [
        "publisher-direction",
        "substack-profile"
      ]
    },
    "manifesto": {
      "label": "Read the manifesto",
      "url": "https://publicdomainpulppress.substack.com/p/manifesto-the-public-domain-is-not",
      "kind": "manifesto",
      "verification": "destination-verified",
      "checkedOn": "2026-10-17",
      "sourceIds": [
        "manifesto"
      ]
    },
    "contactEmail": null
  },
  "sources": [
    {
      "id": "publisher-direction",
      "label": "Publisher content-first instruction, 17 October 2026",
      "location": "Current chat",
      "checkedOn": "2026-10-17",
      "kind": "publisher-instruction",
      "scope": "Separate authors/series; one My Blue Heaven page; primary Substack profile; future publishing lines. Publisher explicitly confirms My Blue Heaven is the prequel to Twenty-Five Dollars a Night."
    },
    {
      "id": "claude-copy",
      "label": "Editorial Copy Package, 17 October 2026, revised pasted version",
      "location": "docs/content-review/Editorial_Copy_Package_2026-10-17.txt",
      "checkedOn": "2026-10-17",
      "kind": "editorial-draft",
      "scope": "Pen-name assignments, genre language and page hierarchy. Revision confirms My Blue Heaven Book Two and Catalina Book Three; records development-title rename and nonpublic treatment. Several plot and newsletter assertions still need verification."
    },
    {
      "id": "kindle-mbh",
      "label": "My Blue Heaven Kindle detail page",
      "location": "https://www.amazon.com/dp/B0HLN6C27N",
      "checkedOn": "2026-10-17",
      "kind": "retailer",
      "scope": "Title, byline, Book Two, Kindle format, date 2026-10-15, 307-page retailer print length and story description."
    },
    {
      "id": "paperback-mbh",
      "label": "My Blue Heaven paperback detail page",
      "location": "https://www.amazon.com/dp/B0HMFVZWCN",
      "checkedOn": "2026-10-17",
      "kind": "retailer",
      "scope": "Title/byline, paperback in stock, date 2026-10-15, 260 pages, ISBN 9798160818450; retail publisher field Independently published."
    },
    {
      "id": "mbh-manuscript",
      "label": "My Blue Heaven supplied manuscript",
      "location": "https://drive.google.com/file/d/14dtlPdgpuL-WJcU1yCnHg0dWxVxO1xKp/view",
      "checkedOn": "2026-10-17",
      "kind": "manuscript",
      "scope": "Publisher identity, byline, human-directed AI-assisted label, music structure and companion playlist."
    },
    {
      "id": "mbh-cover",
      "label": "Existing paperback production cover",
      "location": "/Users/kevinvaughn/Documents/Codex/2026-10-07/referenced-chatgpt-conversation-this-is-an/outputs/covers/My_Blue_Heaven_Full_Wrap.pdf",
      "checkedOn": "2026-10-17",
      "kind": "asset",
      "scope": "Front image extracted and optimized without changing the artwork; displayed cover says Book Two and Samara Bellingham."
    },
    {
      "id": "substack-profile",
      "label": "Publisher-confirmed Substack profile",
      "location": "https://substack.com/@publicdomainpulppress",
      "checkedOn": "2026-10-17",
      "kind": "publisher-instruction",
      "scope": "Canonical primary newsletter destination; profile and publication link observed in browser."
    },
    {
      "id": "manifesto",
      "label": "Manifesto: The Public Domain Is Not a Museum",
      "location": "https://publicdomainpulppress.substack.com/p/manifesto-the-public-domain-is-not",
      "checkedOn": "2026-10-17",
      "kind": "public-post",
      "scope": "Publisher editorial identity and accurately explained AI-assisted process."
    },
    {
      "id": "mbh-excerpt",
      "label": "A First Look at My Blue Heaven",
      "location": "https://publicdomainpulppress.substack.com/p/a-first-look-at-my-blue-heaven",
      "checkedOn": "2026-10-17",
      "kind": "public-post",
      "scope": "Directly opened 17 October 2026; heading confirms Book Two, Chapter Four and readable chapter text was present. Substack displayed a signup modal; permanent free access not promised."
    },
    {
      "id": "master-brief",
      "label": "Original master brief",
      "location": "PublicDomainPulp_Website_Specification.md section 1, S1",
      "checkedOn": "2026-10-17",
      "kind": "publisher-instruction",
      "scope": "Three canonical working series, nine-title inventory, publisher identity and commercial objectives."
    },
    {
      "id": "publisher-spotify-qr",
      "label": "Publisher-supplied Spotify playlist QR",
      "location": "/Users/kevinvaughn/Downloads/spotify_playlist_qr (3).png",
      "checkedOn": "2026-10-17",
      "kind": "asset",
      "scope": "Publisher requests this unchanged QR image on the My Blue Heaven page, alongside its existing playlist link. QR payload not independently decoded in this environment."
    },
    {
      "id": "publisher-spotify-link",
      "label": "Publisher-supplied clickable Spotify link",
      "location": "https://open.spotify.com/playlist/6RCjxSxzDtJNpj5rmsroVg?si=nDw-JdmERdyT6k4qclE96A",
      "checkedOn": "2026-10-17",
      "kind": "publisher-instruction",
      "scope": "Direct publisher confirmation of companion playlist destination; same playlist ID as manuscript."
    },
    {
      "id": "ari-book-copy",
      "label": "Ari source-grounded website copy, received 17 October 2026",
      "location": "docs/content-review/Public_Domain_Pulp_Website_Copy.md",
      "checkedOn": "2026-10-17",
      "kind": "editorial-draft",
      "scope": "Three series introductions and eight catalog teasers/page blurbs; all prose draft, publisher approval pending. Explicit My Blue Heaven prequel label included."
    },
    {
      "id": "ari-source-notes",
      "label": "Ari manuscript and continuity source notes",
      "location": "docs/content-review/Public_Domain_Pulp_Copy_Source_Notes.md",
      "checkedOn": "2026-10-17",
      "kind": "editorial-draft",
      "scope": "Internal manuscript provenance, spoilers to withhold, chronology, version limitations and pending rights/title review. Not public website text."
    },
    {
      "id": "asset-twenty-five-dollars-a-night",
      "label": "Previously located authentic cover: Twenty-Five Dollars a Night",
      "location": "/covers/twenty-five-dollars-a-night.webp",
      "checkedOn": "2026-10-17",
      "kind": "asset",
      "scope": "Existing project web derivative from supplied production cover or observed retailer cover; final edition mapping and web-use approval remain pending."
    },
    {
      "id": "retailer-twenty-five-dollars-a-night-kindle",
      "label": "Twenty-Five Dollars a Night Kindle retailer listing",
      "location": "https://www.amazon.com/dp/B0HJ9VW48L",
      "checkedOn": "2026-10-17",
      "kind": "retailer",
      "scope": "Amazon publisher series listing, title/byline/format and offer checked in browser; metadata preserved from the website project, not supplied by Ari copy."
    },
    {
      "id": "asset-catalina",
      "label": "Previously located authentic cover: Catalina",
      "location": "/covers/catalina.jpg",
      "checkedOn": "2026-10-17",
      "kind": "asset",
      "scope": "Existing project web derivative from supplied production cover or observed retailer cover; final edition mapping and web-use approval remain pending."
    },
    {
      "id": "retailer-catalina-kindle",
      "label": "Catalina Kindle retailer listing",
      "location": "https://www.amazon.com/dp/B0HMMBC8WV",
      "checkedOn": "2026-10-17",
      "kind": "retailer",
      "scope": "Amazon publisher series listing, title/byline/format and offer checked in browser; metadata preserved from the website project, not supplied by Ari copy."
    },
    {
      "id": "asset-tomorrow",
      "label": "Previously located authentic cover: Tomorrow",
      "location": "/covers/tomorrow.webp",
      "checkedOn": "2026-10-17",
      "kind": "asset",
      "scope": "Existing project web derivative from supplied production cover or observed retailer cover; final edition mapping and web-use approval remain pending."
    },
    {
      "id": "retailer-tomorrow-kindle",
      "label": "Tomorrow Kindle retailer listing",
      "location": "https://www.amazon.com/dp/B0HJF1L9VB",
      "checkedOn": "2026-10-17",
      "kind": "retailer",
      "scope": "Amazon publisher series listing, title/byline/format and offer checked in browser; metadata preserved from the website project, not supplied by Ari copy."
    },
    {
      "id": "asset-the-man-from-africa",
      "label": "Previously located authentic cover: The Man from Africa",
      "location": "/covers/the-man-from-africa.webp",
      "checkedOn": "2026-10-17",
      "kind": "asset",
      "scope": "Existing project web derivative from supplied production cover or observed retailer cover; final edition mapping and web-use approval remain pending."
    },
    {
      "id": "retailer-the-man-from-africa-kindle",
      "label": "The Man from Africa Kindle retailer listing",
      "location": "https://www.amazon.com/dp/B0HJ6NQF2Q",
      "checkedOn": "2026-10-17",
      "kind": "retailer",
      "scope": "Amazon publisher series listing, title/byline/format and offer checked in browser; metadata preserved from the website project, not supplied by Ari copy."
    },
    {
      "id": "asset-a-wilder-tomorrow",
      "label": "Previously located authentic cover: A Wilder Tomorrow",
      "location": "/covers/a-wilder-tomorrow.webp",
      "checkedOn": "2026-10-17",
      "kind": "asset",